“ সন্ত্রাস, নাশকতা, হত্যা এবং বিস্ময়ের মধ্য দিয়ে শত্রুর মনোবল ভেঙে দাও, এটাই যুদ্ধের ভবিষ্যৎ ”@,ADOLF_HITLER
“ যে ব্যাক্তি আকাশকে সবুজ দেখে এবং জমিনকে আঁকে নীল রঙে তাকে নপংসুক করে দেয়া কর্তব্য ”@,ADOLF_HITLER
“ একজন খ্রিস্টান হিসেবে প্রতারিত হওয়া আমার কর্তব্য নয়, কর্তব্য হলো সত্য এবং ন্যায়ের জন্য যুদ্ধ করা ”@,ADOLF_HITLER
“ জার্মানি হবে পৃথিবীর সর্বশক্তিমান নয়তো কিছুই নয় ”@,ADOLF_HITLER
“ শক্তি প্রতিরোধে নয়, আক্রমণেই প্রকাশিত হয় ”@,ADOLF_HITLER
“ কে বলেছে আমি ঈশ্বরের দ্বারা সুরক্ষিত নই ”@,ADOLF_HITLER
“ সংসারে কারো ওপর ভরসা করো না, নিজের হাত এবং পায়ের ওপর ভরসা করতে শেখো ”@,WILLIAM_SHAKESPEARE
“ মনের সৌন্দর্যকে যে অগ্রাধিকার দেয় সংসারে সেই জয়লাভ করে ”@,WILLIAM_SHAKESPEARE
“ জীবন মানে অনিশ্চিৎ ভ্রমণ ”@,WILLIAM_SHAKESPEARE
“ পৃথিবীর জীবন নামক নাট্যমঞ্চে সবাই একেকজন অভিনেতা/ অভিনেত্রী। শুধুমাত্র চরিত্রগুলো ভিন্ন। ”@,WILLIAM_SHAKESPEARE
“ ভীরুরা মরার আগে বারে বারে মরে। সাহসীরা মৃত্যুর স্বাদ একবারই গ্রহণ করে। ”@,WILLIAM_SHAKESPEARE
“ যদি গুন না থাকে তবে অভিনয় করো ”@,WILLIAM_SHAKESPEARE
“ কাউকে সারা জীবন কাছে পেতে চাও? তাহলে প্রেম দিয়ে নয় বন্ধুত্ব দিয়ে আগলে রাখো। কারণ প্রেম একদিন হারিয়ে যাবে কিন্তু বন্ধুত্ব কোনদিন হারায় না ”@,WILLIAM_SHAKESPEARE
“ তারাই সুখী যারা নিন্দা শুনে এবং নিজেদের সংশোধন করতে পারে ”@,WILLIAM_SHAKESPEARE
“ আমার ভালো বন্ধুদের কথা মনে করে আমি যতোটা সুখী হতে পারি, অন্য কোনোভাবে ততোটা সুখী হতে পারি না ”@,WILLIAM_SHAKESPEARE
“ সচেতনতা আমাদের সবাইকে কাপুরুষ বানিয়ে দিয়েছে ”@,WILLIAM_SHAKESPEARE
“ সততার নিকট দুর্নীতি কোনোদিনই জয়ী হতে পারে না ”@,WILLIAM_SHAKESPEARE
“ নারীর কাছে সন্তান প্রসব একটা তৃপ্তিকর শান্তি ”@,WILLIAM_SHAKESPEARE
“ প্রত্যাশাই সকল মর্মবেদনার কেন্দ্র বিন্দু ”@,WILLIAM_SHAKESPEARE
“ আমি সবসময় নিজেক সুখী ভাবি, কারণ আমি কখনো কারো কাছে কিছু প্রত্যাশা করি না, কারো কাছে কিছু প্রত্যাশা করাটা সবসময়ই দুঃখের কারণ হয়ে দাঁড়ায় ”@,WILLIAM_SHAKESPEARE
“ অভাব যখন দরজায় এসে দাঁড়ায়, ভালোবাসা তখন জানালা দিয়ে পালায় ”@,WILLIAM_SHAKESPEARE
আমার সফলতার ভিত্তিতে আমাকে বিচার ক'রো না, আমাকে বিচার করো আমার ব্যর্থতা এবং ব্যর্থতার পর ঘুরে দাঁড়ানোর ভিত্তিতে।@,NELSON_MANDELA
আমি সাধু নই, তবে যদি সাধুকে এমন এক পাপী হিসেবে বিবেচনা কর, যে সৎ হবার জন্য তার চেষ্টা চালিয়ে যাচ্ছে, তাহলে আমি তাই।@,NELSON_MANDELA
 ঘৃণা মনকে অন্ধকার করে দেয়। কৌশলের পথ রুদ্ধ করে দেয়। নেতাদের ঘৃণা করা সাজে না।  @,NELSON_MANDELA
 যদি কেউ ঘৃণা করতে শেখে তাহলে সে ভালোবাসা শিখে নিতে পারে। ঘৃণা নয়, মানব হৃদয়ে স্বাভাবিকভাবে ভালোবাসার জন্ম হয়।@,NELSON_MANDELA
 ঘৃণা নিয়ে কেউ জন্ম গ্রহণ করে না।@,NELSON_MANDELA
 সাহসী মানুষের শান্তির জন্য ক্ষমা করতে ভীত নয়।@,NELSON_MANDELA
পৃথিবীতে প্রতিশোধ গ্রহণের মাধ্যমে আপনি যতটা অর্জন করতে পারবেন, তার চেয়ে ঢের বেশি অর্জন করতে পারবেন ক্ষমা প্রদর্শনের মাধ্যমে।@,NELSON_MANDELA
যেখানে একসময় থাকে বেদনার বসবাস, খেলাধুলা সেথায় করতে পারে আশাবাদের চাষ।@,NELSON_MANDELA
পেছন থেকে নেতৃত্ব দাও- আর সাথে অন্যদের বিশ্বাস দাও যে নেতার আছে সম্মুখসারিতে।@,NELSON_MANDELA
 আমি বর্ণবাদকে ঘৃণা করি কারণ এটা একটা বর্বর বিষয়, তা সে কালো বা সাদা যেকোনো মানুষের কাছ থেকে আসুক না কেন।@,NELSON_MANDELA
সব সময়, যতক্ষণ না কাজ সমাধা হচ্ছে ততক্ষণ পর্যন্ত তা এক অসম্ভব বিষয় বলে মনে হয়।@,NELSON_MANDELA
যেকোনো কিছুতে ভীত নয়; সে নয়, বরঞ্চ যে ভয়কে জয় করে সেই হচ্ছে প্রকৃত সাহসী।@,NELSON_MANDELA
সম্মান তাদের প্রাপ্য, যারা কখনো সত্যকে পরিত্যাগ করে না, এমনকি যখন পরিস্থিতি অন্ধকারচ্ছন্ন এবং বেদনাদায়ক।@,NELSON_MANDELA
 কেবল শৃঙ্খলহীন হওয়া নয়, বরং স্বাধীন হওয়া মানে শ্রদ্ধা এবং অন্যের স্বাধীনতা বৃদ্ধির সাথে বসবাস।@,NELSON_MANDELA
শিক্ষা হচ্ছে সবচেয়ে শক্তিশালী অস্ত্র, যার মধ্যে দিয়ে পৃথিবীকে বদলে ফেলা যায়।@,NELSON_MANDELA
বলা হয়ে থাকে যে সত্যিকার অর্থে কেউ একটি জাতিকে জানতে পারে না যতক্ষণ না কেউ একজন এর কারাগারে বন্দি থাকে।@,NELSON_MANDELA
 যখন একজন মানুষ বিবেচনা করা যে নিজ জাতি এবং স্বদেশের প্রতি সে তার দায়িত্ব পালন করেছে, তখন সে শান্তিতে মৃত্যু বরণ করতে পারে।@,NELSON_MANDELA
“ছোট বিষয়ে বিশ্বস্ত হও কারন এর উপরেই তোমার শক্তি নির্ভর করে। ”@,MOTHER_TERESA
“আমি ঈশ্বরের হাতের একটি ছোট পেন্সিল যা দ্বারা ঈশ্বর পৃথিবীতে ভালোবাসার চিঠি লিকছেন।”@,MOTHER_TERESA
 ‘আসুন, আমরা সবাই মিলে প্রার্থনা করি। প্রভু, আমাদের যোগ্য করো, যেন আমরা সারা পৃথিবীতে যেসব মানুষ দারিদ্র্যের মধ্যে ক্ষুধার মধ্যে জীবন যাপন করেন, মৃত্যুমুখে পতিত হন, তাদের সেবা করতে পারি।’@,MOTHER_TERESA
কেবল সেবা নয়, মানুষকে দাও তোমার হৃদয়। হৃদয়হীন সেবা নয়, তারা চায় তোমার অন্তরের স্পর্শ।’@,MOTHER_TERESA
আনন্দই প্রার্থনা, আনন্দই শক্তি, আনন্দই ভালোবাসা।’@,MOTHER_TERESA
 ‘হৃদয়কে স্পর্শ করতে চায় নীরবতা। কলরবের আড়ালে নীরবেই পৌঁছাতে হয় আর্তের কাছে।’@,MOTHER_TERESA
 ‘তুমি যখন কারো সঙ্গে দেখা করো তখন হাসিমুখ নিয়েই তার সামনে যাও। কেননা হাস্যোজ্জ্বল মুখ হলো ভালোবাসার শুরু।’@,MOTHER_TERESA
‘আমার শরীরজুড়ে প্রবাহিত আলবেনিয়ান রক্ত, নাগরিকত্বে একজন ভারতীয় আর ধর্মীয় পরিচয়ে আমি একজন ক্যাথলিক নান। তবে নিজের অন্তর্নিহিত অনুভূতি দিয়ে আমি অবগাহন করি বিশ্বময় এবং মনে-প্রাণে আমার অবস্থান যিশুর হৃদয়ে।’@,MOTHER_TERESA
‘ভালবাসার কথাগুলো হয়তো খুব সংক্ষিপ্ত ও সহজ হতে পারে কিন্তু এর প্রতিধ্বনী কখনো শেষ হয় না।’@,MOTHER_TERESA
‘তুমি যদি মানুষকে বিচার করতে যাও তাহলে ভালোবাসার সময় পাবে না।’@,MOTHER_TERESA
‘শান্তির জন্য কাজ করলে তাতেই যুদ্ধ কমে যায়। কিন্তু রাজনীতির মধ্যে আমি যাব না। রাজনীতি থেকেই যুদ্ধের উদ্ভব হয়। সেজন্য রাজনীতির সঙ্গে জড়িয়ে পড়তে আমি চাই না। রাজনীতির মধ্যে যদি আমি বাঁধা পড়ে যাই, তাহলে আর ভালোবাসতে পারব না। কেননা, তখন সকলের পক্ষে আর নয়, আমাকে দাঁড়াতে হবে একজনের পক্ষে।’@,MOTHER_TERESA
‘ঈশ্বর পৃথিবীকে ভালোবাসেন এবং তিনি আপনাকে, আমাকে পাঠিয়েছেন তার ভালোবাসা এবং সহায়তা দরিদ্রদের কাছে পৌঁছে দেওয়ার জন্য।’@,MOTHER_TERESA
‘তুমি কী করলে তার চাইতে তুমি কতটা ভালোবাসা দিয়ে করলে তা-ই মুখ্য।’@,MOTHER_TERESA
“তুমি দৃশ্যমান মানুষকে ভালোবাসতে না পারো তবে অদৃশ্য ঈশ্বরকে কি করে ভালোবাসবে?”@,MOTHER_TERESA
 “আমাদের মধ্যে সবাই সব বড় কাজগুলো করতে পারে না, কিন্তু আমরা অনেক ছোট ছোট কাজ করতে পারি আমাদের ভালোবাসা দিয়ে।”@,MOTHER_TERESA
 “নেতার জন্য বসে থেকো না, একাই ব্যাক্তি থেকে ব্যাক্তি শুরু করে দেও।”@,MOTHER_TERESA
“সত্যিকারের ভালোবাসার অর্থ হলো যতক্ষন তা কষ্ট না দেয় ততক্ষন দেওয়া।”@,MOTHER_TERESA
 “তুমি যদি শতশত লোকের খুধা মিটাতে না পারো তাহলে শুধুমাত্র একজনকে খাওয়াও।”@,MOTHER_TERESA
 “শান্তির শুরুই হয় হাসির মাধ্যমে।”@,MOTHER_TERESA
“গতকাল চলে গেছে, আগামিকাল এখনো আসেনি, আমাদের জন্য আছে আজকের দিন, এখনই শুরু করা যাক।”@,MOTHER_TERESA
 “কিছু লোক তোমার জীবনে আশির্বাদ হয়ে আসে, কিছু লোক আসে শিক্ষা হয়ে।”@,MOTHER_TERESA
“আশা করো না যে তোমার বন্ধু নির্ভুল ব্যাক্তি হবে বরং তোমার বন্ধুকে নির্ভুল হতে সহায়তা করো এটাই প্রকৃত বন্ধুত্ব।”@,MOTHER_TERESA
কোন সভ্য জাতিকে অসভ্য করার ইচ্ছা যদি তোমার থাকে, তাহলে তাদের বইগুলো ধ্বংস কর, সকল পন্ডিতকে হত্যা কর, তোমার উদ্দেশ্য সিদ্ধ হবে।@,LUTFOR_RAHMAN
জাতি যখন দৃষ্টিসম্পন্ন ও জ্ঞানী হয়, তখন জাগবার জন্য সে কারো আহবানের অপেক্ষা করে না, কারন, জাগরনই তার স্বভাব।@,LUTFOR_RAHMAN
 তুমি তোমার ব্যক্তিত্বকে দৃঢ় করে তোল। কেউ তোমার উপর অন্যায় আধিপত্য করতে পারবে না।@,LUTFOR_RAHMAN
যুবকদের গায়ের জোরে আস্থা খুব বেশি। বিচার বৃদ্ধি বিবেকের দাবি তাদের কাছে নাই। ঔদ্ধত্য প্রকাশ তাদের স্ব-প্রকৃত।@,LUTFOR_RAHMAN
 সাহিত্যের কাজ মানুষকে তার চারিদিককার মন্দ শক্তির বিরুদ্ধে বিদ্রোহী করে তোলা।তার মধ্যে সমাজ বন্ধু বান্ধব আত্মীয় স্বজনকে অগ্রাহ্য করে ন্যায় সত্য ও আল্লাহকে মেনে নেবার প্রবৃত্তি করে দেওয়া।@,LUTFOR_RAHMAN
মানুষ যতই ছোট হোক, যতই সে অবজ্ঞাত হয়ে থাকুক, তার মাঝে অসীম ক্ষমতা, অনন্ত প্রতিভা ঘুমিয়ে আছে। অনুকূল পরিবেশ পেলে তার ভেতরকার রূপ মহিমা অনন্ত শিখায় ফুটে উঠবে। @,LUTFOR_RAHMAN
 যার যেটা নেই সে কখনও সেটার মূল্য বুঝে না, একমাত্র সেই ব্যক্তিই সেটার মূল্য বুঝে যার কোন জিনিস পূর্বে ছিল কিন্তু এখন নেই।@,REDWAN_MASUD
 ভবিষ্যতে যার কাছ থেকে তুমি সবচেয়ে বড় কষ্টটি পাবে, আজ সে তোমার সবচেয়ে কাছের কোন একজন।@,REDWAN_MASUD
স্বপ্ন তাকে নিয়েই দেখ যে শুধু স্বপ্ন দেখায় না বাস্তবায়নও করে, কিন্তু এমন কাউকে নিয়ে স্বপ্ন দেখ না যে স্বপ্ন দেখিয়ে নিজেই হারিয়ে যায়।@,REDWAN_MASUD
পৃথিবীতে কঠিন বাস্তবের মধ্যে একটি বাস্তব হলোঃ মানুষ যখন সাফল্যের দ্বারপ্রান্তে এসে পৌছায় আর তখনই তার প্রিয় মানুষটি হারিয়ে যায়।@,REDWAN_MASUD
সুখে থাকাই জীবনের চরম সার্থকতা নয় বরং কাউকে সুখে রাখতে পারাটাই হলো জীবনের সবচেয়ে বড় সার্থকতা।@,REDWAN_MASUD
কেউ তোমাকে অনেক ভালোবাসবে, সহজেই অনেক আপন করে নিবে। আর তাতে তুমি আনন্দে ভেসে যেও না। এ আনন্দ তোমার জন্য নাও সইতে পারে। অপেক্ষা করো সময়ের জন্য। সময়ই বলে দিবে এ ভালবাসা তোমার জন্য দুঃখের না সুখের।@,REDWAN_MASUD
জীবন চলার পথে বাঁধা আসতেই পারে তাই বলে থেমে যাওয়ার কোন অবকাশ নেই,যেখানে বাঁধা আসবে সেখান থেকেই আবার শুরু করতে হবে।@,REDWAN_MASUD
 একটা ভুল মানুষকে হয়তো অনেক কাঁদায়, কিন্তু মনে রাখতে হবে জীবনে এমন কিছু ভুল আছে যা ভবিষ্যতে হাজারটা ভুল থেকে বাচায় @,REDWAN_MASUD
তার জন্য কাঁদ যে তোমার চোখের জল দেখে সেও কেঁদে ফেলে, কিন্তু এমন কারো জন্য কেদোনা যে তোমার চোখের জল দেখে উপহাস করে।@,REDWAN_MASUD
 আবেগ আর বিবেক দুইটাই ভিন্ন জিনিস। আবেগ বেশিরভাগ ক্ষেত্রেই ক্ষতিকর আর বিবেক মানুষকে ভাল মন্দ বাছাই করতে শিখায়। কিন্তু দুঃখজনক হলেও সত্য যে আমরা সবাই আবেগের কাছে বিবেক হারাই, কিন্তু বিবেকের কাছে আবেগ হারাই না।@,REDWAN_MASUD
কাঁদতে হলে বিবেকের প্রয়োজন হয় না, শুধু আবেগ থাকলেই হয়। কিন্তু হাসতে গেলে কোন কোন সময় বিবেকের প্রয়োজন হয়। কারণ আমরা অনেকই আছি যারা মানুষের বিপদ দেখলে হাসি।@,REDWAN_MASUD
কারো জন্য কিছু থেমে না থাকলেও মনে কিছু আক্ষেপ থেকে যায়, যা কোন দিন ও শেষ হয় না, শুধু জীবন ভরে কাদায়।@,REDWAN_MASUD
তোমাকে ছাড়া থাকার কোন সাধ্য আমার নেই কারণ তোমাকে আমি আমার জীবনের চেয়েও বেশি ভালোবাসি। তোমাকে ধরে রাখার কোন উপায় আমার কাছে জানা নেইকারণ বাস্তবতার কাছে আমি বড় অসহায়।@,REDWAN_MASUD
তুমি তার জন্য কাঁদো কারণ তুমি তাকে এখনও ভালোবাস, তোমার কান্না দেখে সে হাসে  কারণ সে কখনোই তোমাকে ভালোবাসেনি শুধু সময়ের প্রয়োজনে কাছে এসেছিল আবার সময়ের পরিবর্তনে চলে গেছে, মাঝখানে যা কিছু হয়েছিসব আবেগ আর শেষে যা হয়েছে সব প্রতারণা।@,REDWAN_MASUD
পৃথিবীতে তোমার হাজার হাজার আত্মীয়-স্বজন,বন্ধু-বান্ধব ও শুভাকাঙ্ক্ষী থাকবে, কিন্তু সবশেষে তুমি একজন মানুষকেই খুজে পাবে, যাকে তুমি শত আঘাত দেওয়ার পরেও সে শুধু তোমার ভবিষ্যত নিয়েই ভাবে, আর তিনি হলেন মা।@,REDWAN_MASUD
পৃথিবীতে কেউ কারো নয় শুধু সুখে থাকার আশায় কাছে টানার ব্যার্থ প্রত্যয় আর দূরে চলে যাওয়ার এক বাস্তব অভিনয়।@,REDWAN_MASUD
ভালোবাসা মানে এই নয় যে কাউকে বিয়ে করতেই হবে, কখনও কখনও ভালোবাসার মানুষের সুখের জন্য বুকের ভেতর শত যন্ত্রনা ঢেকে রেখে হাসি মুখে প্রেমিক/প্রেমিকাকে বিদায় দিতে হয়।@,REDWAN_MASUD
ভুল থেকেই মানুষ শিখে, কিন্তু সে ভুলটি যেন না হয় জীবনের শেষ ভুল। কারণ এমনও হতে পারে আপনি যে সুযোগটি হাতছাড়া করে ফেলেছেন,সে সুযোগটিই ছিল আপনার জীবনের শেষ সুযোগ।@,REDWAN_MASUD
কাউকে কখনও বেশি আপন করে নিও না, তাহলে তার কাছে তোমার নিজের অস্তিত্বই হুমকির মুখে পড়বে।@,REDWAN_MASUD
বন্ধুর সাথে ভালোবাসার সম্পর্কে জড়ানো ঠিক নয়। বন্ধুত্ব সম্পর্কটা চির দিনের জন্য যা কোন কারনে ভেঙ্গে গেলেও আবার কোন দিন না কোন দিন জোড়া লাগে কিন্তু ভালোবাসার মানুষটির সাথে সম্পর্ক ভেঙ্গে গেলে ভালোবাসার পাশাপাশি বন্ধুত্বের সম্পর্কটাও হারিয়ে যায়।@,REDWAN_MASUD
কিছু মানুষের কষ্ট চোখ দিয়ে ঝরে কিছু মানুষের কষ্ট মেজাজ দিয়ে প্রকাশ করে কিছু মানুষের কষ্ট হৃদয়ের মাঝে শুকিয়ে মরে তবে কষ্টকে যারা প্রকাশ করতে না পারে, তারাই জীবনে সবচেয়ে বেশি কষ্ট করে।@,REDWAN_MASUD
